{
  "$schema": "https://json-schema.org/draft/2020-12/schema",
  "$id": "medioevo.theatre_lineage.v0.1",
  "title": "TheatreLineage",
  "type": "object",
  "required": ["schema_version", "lineage_id", "agent_id", "great_grandparents", "grandparents", "parents", "inherited_traits", "family_history", "predispositions", "initial_memory", "boundary"],
  "properties": {
    "schema_version": { "const": "medioevo.theatre_lineage.v0.1" },
    "lineage_id": { "type": "string" },
    "agent_id": { "type": "string" },
    "great_grandparents": { "type": "array" },
    "grandparents": { "type": "array" },
    "parents": { "type": "array" },
    "inherited_traits": { "type": "array" },
    "family_history": { "type": "array" },
    "predispositions": { "type": "object" },
    "initial_memory": { "type": "array" },
    "boundary": { "type": "object" }
  },
  "additionalProperties": false
}

